<!ELEMENT liga (jornada+)>
        <!ATTLIST liga
                nombre CDATA #REQUIRED
                temporada CDATA #REQUIRED>

        <!ELEMENT jornada (partido+)>
        <!ATTLIST jornada
                numero CDATA #REQUIRED
                fecha CDATA #REQUIRED>

        <!-- Un partido debe respetar estrictamente esta secuencia de elementos -->
        <!ELEMENT partido (estadio, equipoLocal, equipoVisitante, marcador)>
        <!ATTLIST partido
                id ID #REQUIRED
                estado (Programado|En_curso|Finalizado) #REQUIRED>

        <!ELEMENT estadio (#PCDATA)>

        <!ELEMENT equipoLocal (estadisticas?)>
        <!ATTLIST equipoLocal
                nombre CDATA #REQUIRED>

        <!ELEMENT equipoVisitante (estadisticas?)>
        <!ATTLIST equipoVisitante
                nombre CDATA #REQUIRED>

        <!-- Las estadísticas pertenecen a cada equipo para mayor claridad y modularidad -->
        <!ELEMENT estadisticas (goles, tiros?, tarjetasAmarillas?, tarjetasRojas?)>
        <!ELEMENT goles (#PCDATA)>
        <!ELEMENT tiros (#PCDATA)>
        <!ELEMENT tarjetasAmarillas (#PCDATA)>
        <!ELEMENT tarjetasRojas (#PCDATA)>
        <!ELEMENT marcador (#PCDATA)>